Texto,Texto,Texto,,,,,
,,“New management and a commitment to rein-in costs should help the story but the biggest catalyst would be a return to [daily-active-user] growth which we believe will happen when the newer lightweight and faster Android app is rolled out” wrote Barclays analyst Ross Sandler who has an overweight rating and $16 price target on the stock.,,,,,
,,Dear Poor Parent,,,,,
,,Because of its industrial use the metal is often referenced as a leading economic indicator and recent declines have been attributed to signs of cracks in China’s economy which market experts say have been amplified by Beijing's trade clash with the U.S.,,,,,
You could cut the price tag a little further just by saying you’ll send $500 rebate checks to everyone making under $200000. That would cost $83 billion for one year using JCT estimates for the number of taxpayer units.,,,,,,,
,,It’s a model whose time has come said Ben Harris formerly the chief economist to Vice President Joe Biden and now a lecturer at the Kellogg School of Management who’s written quite a bit about real estate market inefficiencies. In a 2011 research paper for example Harris demonstrated that for anyone selling a home that had been owned for four years or less the transaction costs were the biggest expense associated with homeownership.,,,,,
• Marijuana beverages are the new thing but investors should only take sips,,,,,,,
,,Don’t miss: Awkward questions for your financial adviser,,,,,
,,Also read:  The housing market’s slowdown is going to kill the home renovation boom too,,,,,
In terms of bear markets the SOX index is marching toward one now that it is more than 16% off its high of 1464.62 set on March 13. A bear market is generally defined as when a security or index falls more than 20% from a recent peak.,,,,,,,
,,"Stock movement: Snap shares have declined more than 53% so far this year as the S&P 500 SPX -0.55%

     has gained 2.5%.",,,,,
,Read: The stock market faces ‘unlimited downside risk’ warns veteran trader,,,,,,
,,REX also differs from ShowPal in that it “Uber-izes” in Rothman’s words the showing process.,,,,,
,,As the researchers wrote “To us this suggests at least in Boston you can’t tell the value of a home by its exterior but our point estimates do also imply that better appearance significantly increases price.”,,,,,
,,Torstenson has little patience for those arguments. “In many cases gosh it would just be cheaper to also hire a therapist” he said when asked about the hand-holding many real-estate agents do for skittish clients.,,,,,
,,"Japan’s Nikkei 225 index NIK -2.67%

     tumbled 2.7% and the Hong Kong’s Hang Seng Index HSI -3.08%

     dropped 3.1% in line with the retreat in China.",,,,,
• Smart money flows are extremely negative in Tilray TLRY -1.48% and marijuana ETF MJ -2.88%,,,,,,,
,,Lund acknowledges that the built-in advantages to that closed system only persist as long as the current state of play does. If disruptors like ShowPal and REX – and other innovations like companies that buy homes from consumers – gain a foothold the MLS monopoly may be shaken.,,,,,
,And finally Parets took a look at what Dow Theory is telling us.,,,,,,
This idea here is that when either industrial or transportation stocks make new highs it’s important for the other to follow. When that confirmation doesn’t come there’s cause for concern.,,,,,,,
,,Following the sale of Costa Whitbread will be a focused hotel businesses in the UK the Middle East and Germany which is shifting from independent hotels to branded hotels and could become a bigger focus for Whitbread in the future.,,,,,
But Trump has repeatedly characterized his new proposal as being for middle-income taxpayers. So perhaps upper-income taxpayers are excluded even though such a restriction doesn’t seem characteristic of the Trump administration.,,,,,,,
,,Also see:  I lived in fear of rogue advisers and dementia — but I changed my financial plan my medication and my life,,,,,
,,Both Michael Piston and Susan Fortino-Brown who represented Carreira in the underlying proceedings said they’ve been seeing the decision quality on employment-based visas deteriorate since Trump’s April 2017 “Buy American and Hire American” executive order.,,,,,
,,Want news about Asia delivered to your inbox, Subscribe to MarketWatch's free Asia Daily newsletter. Sign up here.,,,,
,,However one item in favor of the IRA is a desire to convert pretax money to Roth accounts. Not all 401(k)s allow conversions to Roth 401(k)s. Further if you have never had a Roth IRA converting IRA money starts the five-year clock for making earnings tax-free upon distribution. Also Roth IRAs are not subject to Required Minimum Distributions at age 70 ½ but Roth 401(k) accounts are.,,,,,
,,"Shares of PulteGroup Inc. PHM +7.28% surged 6.7% in midday trade to bounce off the previous session's 21-month low after the home builder reported third-quarter earnings that beat expectations although sales came up a bit shy. In the post-earnings conference call Chief Executive Ryan Marshall said that while increasing volume of consumer traffic suggest home buying interest remains high the company-wide absorption pace was down suggesting affordability resulting from higher interest rates and home prices is becoming a bigger hurdle for buyers to overcome according to a transcript provided by FactSet. Adjustments the company said it can make within its communities to increase affordability include incentives related to home option packages and financing incentives. ""And then of course the easiest thing potentially to do and sometimes the most painful from a profitability standpoint is just absolute base price adjustments"" Marshall said. ""And we tend to go there last is the kind of the order of magnitude of change that we would typically make.""",,,,,
,1. Early retirees are not withdrawing from life. They’re embracing a purposeful life MORE fully than ever.,,,,,,
,,As background I grew up with the same trust amounts and when I reached about 24 was finally given control of my money and I only had $20000. I am sure that my dad spent my money on my upkeep possibly even made me pay for my own boarding school. We really cannot afford for to pay for “culturally” enriching stuff.,,,,,
Read more: Here’s how much Tesla lost in market cap now that Musk’s SEC settlement is approved,,,,,,,
,Musk has vowed to show profits in the third and fourth quarters.,,,,,,
,,"And then take tweets about the stock market — from the president from Elon Musk (the former chief executive officer of auto maker Tesla TSLA +12.72%

     who tweeted about taking the company private and caused chaos) or from anyone else — with skepticism. “Reach out to someone who you can figure out your personal situation with but don’t make rash or emotional decisions based on what you read on social media” Geifer said.",,,,,
,,The words we choose when describing someone’s performance in the workplace matter — they can have a profound impact on their career.,,,,,
,,But the evidence left the decider cold.,,,,,
,The broad sector selloff comes despite early indications of strong demand since full-legalization.,,,,,,
,,At present the EU imposes a 10% tariff on imported U.S. cars while the U.S. tacks on a 2.5% tariff on passenger cars made in Europe and a 25% tariff on imported pickup trucks.,,,,,
,,Puzzles. Defying gravity. Unexplained phenomenon. Halloween.,,,,,
,,Lund predicts a “single-digit percentage of consumers” will flock to the graduated-services model of companies like ShowPal and REX “but the majority are going to continue to do it the way they do it because it works. There’s a lot that local real estate agents do that don’t show up in economic calculations.”,,,,,
,,Americans with 401(k) plans should not run to their plan administrator to change their contribution rates or asset allocations advisers said. “If you’re someone working and saving in a 401(k) plan your long-term savings strategies won’t be materially impacted by who won the midterm elections in 2018” Geifer said. “Focus your energy elsewhere on things you can control.”,,,,,
,,Read:  Your financial adviser’s ‘sleep easy’ portfolio may be riskier than you think,,,,,
,,The couple spent several weeks trying to get their home listed on Zillow a process Fischer called “a bit of a mess.” ShowPal saw the Zillow ad and reached out to Fischer.,,,,,
,Last week a federal judge approved Musk’s settlement with the SEC reached last month to end charges that Musk misled investors and violated securities laws by tweeting he had “funding secured” to take Tesla private. Musk and Tesla agreed to the settlement without admitting or denying the allegations.,,,,,,
,,“It seems as though there is an interest in finding a way to deny these petitions” she added. “In my practice this has regrettable become more and more common under the Trump administration.”,,,,,
,,As more advisers charge based on the time they spend serving clients (such as an hourly rate or a monthly or quarterly retainer) the assets-under-management fee structure will fade Veres predicts. He favors this shift arguing that charging a percentage of assets is “not a sustainable business model.”,,,,,
,,Read:  Here are the early signs China’s stock-market woes are starting to infect the rest of the world,,,,,
,Citron’s note comes after the Silicon Valley car maker announced late Monday that it will report third-quarter results on Wednesday much sooner than anticipated.,,,,,,
,,Another newish player REX offers what it calls a “full service low fee” approach. The amount any seller pays is always 2% and if a buyer wants to work with his or her own agent that professional must accept those terms. As an alternative to that uncomfortable conversation the Los Angeles-based REX will provide one of its own on-staff salaried brokers to any buyer. “We never ask anyone to go without representation” REX spokesman Eric Rothman said. REX has been around since 2015 and is currently raising a Series C round of funding.,,,,,
,Also read: All the potential red flags for investors in IGC the pot stock that jumped 1000% in three months.,,,,,,
,"Tesla shares have lost 11% this year and 18% in the last 12 months. That compares with gains of 1.4% and 0.9% for the S&P 500 index SPX -0.55%

     and the Dow Jones Industrial Average DJIA -0.50%

     in the same period.",,,,,,
,,The president’s previous tweets on 401(k) plans have taken credit for how well the stock market is doing since he was elected which translates to greater returns in retirement accounts. His recent tweet on 401(k) plans suggests something along the lines of: “if you elect someone else who is not embracing my philosophies and programs it will hurt your pocket book’” said Dennis Nolte vice president of Seacoast Investment Services in Winter Park Fla.,,,,,
,—Chris Matthews and Barbara Kollmeyer contributed to this article,,,,,,
,,You could also refinance the property and take that money and invest it elsewhere. Bottom line: These are all good questions. My gut tells me you that you’re absolutely right to question what you should do with this rental and as you turn 60 there’s no better time to shake up your financial situation and ask tough questions. But maybe 2018 isn’t the year to do it.,,,,,
,"Despite the long losing streak the Horizons ETF was still up 19% over the past three months and the ETFMG ETF was up 22% while the S&P 500 indexSPX -0.55%

    has lost 2.5%.",,,,,,
,,Chinese e-commerce giant Alibaba Group Holding Limited has won a preliminary injunction against cryptocurrency firm Alibabacoin Foundation.,,,,,
,,One of my close friends is working with an executive coach who is helping her get to the next level. Her performance reviews generally indicate that she is on track for a promotion. But when one of the male execs on her panel gave her the feedback that she is “aggressive” and recommended that she be “less aggressive” her morale was shaken.,,,,,
,Now read: The real reason marijuana stocks are falling off a cliff — and what to do now,,,,,,
,,“The bigger question longer term will be whether the UK really needs so many more hotels” analysts at AJ Bell said. “The industry continues to build and build plus there is the additional factor of Airbnb offering plentiful supply of accommodation” they added.,,,,,
,,“Present-day socialists do not want the dictatorship or state brutality that often coincided with the most extreme cases of socialism” the report said. “However peaceful democratic implementation of socialist policies does not eliminate the fundamental incentive and information problems created by high tax rates large state organizations and the centralized control of resources.”,,,,,
,• Smart money flows are neutral in Green Organic Dutchman Holdings TGODF -1.90%,,,,,,
,,This article is reprinted by permission from NextAvenue.org. It is adapted from the book “Nevertheless She Persisted: True Stories of Women Leaders in Tech” by Pratima Rao Gluckman. Reprinted with permission of the author.,,,,,
,,“As the company bolsters its self-serve offering continues to innovate on the Snapchat pixel and adds more dynamic advertising use-cases and ad formats we believe pricing will begin to stabilize on a year-over-year basis in 2019” he wrote.,,,,,
Citron acknowledged its long-held bearish view on Tesla and its surprising turn: “As much as you can’t believe you are reading this we can’t believe we are writing this!”,,,,,,,
,,“Collaborative planning means that you start with a thorough multiple-meeting conversation about your clients’ goals what money means to them what they are saving for and then helping them refine those goals” said Veres author of “The New Profession.”,,,,,
,,The president took to Twitter to defend tariffs as being “great...for negotiations” and as leverage for what he called fair trade deals.,,,,,
,,Naturally the past is not a guarantee of the future.,,,,,
Last week a federal judge approved Musk’s settlement with the SEC reached last month to end charges that Musk misled investors and violated securities laws by tweeting he had “funding secured” to take Tesla private. Musk and Tesla agreed to the settlement without admitting or denying the allegations.,,,,,,,
,,The cryptocurrency AlibabaCoin or ABBC has a market value of $1.9 million and is trading at 71 cents according to data from CoinMarketCap. The coin had reached an all-time high of $1.63 on Oct. 18 2018. Meanwhile Alibaba boasts a market value of more than $330 billion.,,,,,
Tesla scheduled a post-results call with analysts at 3:30 p.m. Pacific about one hour later than usual. Ford Motor Co. is also scheduled to report after the bell on Wednesday.,,,,,,,
,,If you are self-certifying that you are eligible for a waiver because of illness you should be able to demonstrate two things: first you need to show that the medical issue impaired your ability to complete a timely rollover and next you need to show the funds were not used for personal reasons in the intervening time.,,,,,
,,The company noted in its report that its own spending on Facebook ads topped $12 million in May through October as it pushed a message about how it’s “strengthening security during elections.”,,,,,
,,That $8000 per year seems like an endless well of ballet or gymnastic classes or summer camps with other young girls born of wealthy parents with double-barreled names. Who knows, She could be the next Misty Copeland or Simone Biles. You can pay for these things and hope that all of these extra-curricular activities instill in her the expectation and confidence that perhaps you didn’t have at that age. It’s a luxury to take things for granted especially when you are young.,,,,
,,Wedbush analyst Michael Pachter thinks that a more self-aware company can emerge at Snap.,,,,,
,,Get a daily roundup of the top reads in personal finance delivered to your inbox. Subscribe to MarketWatch's free Personal Finance Daily newsletter. Sign up here.,,,,,
,,“Combined these two would add 142 [basis points] to the average global import tariff essentially reversing about 15 years of progress in global tariff reduction” said UBS chief economist Arend Kapteyn and his colleagues in a recent note.,,,,,
,,Christina Carreira is one half of a team that’s lit the ice on fire. She and her partner Anthony Ponomarenko are the world’s top junior ice dance team and have racked up 10 medals — including four gold medals — in international competition since 2016. She’s currently in the country legally on a visa that allows her to train here temporarily.,,,,,
,,Opinion: Why Ted Cruz will defeat Beto O’Rourke in their Texas Senate,,,,,
,"Meanwhile the Horizons marijuana ETF was still up 21% over the past three months and the ETFMG ETF was up 23% while the S&P 500 indexSPX -0.55%

    has slipped 1.8%.",,,,,,
,,Indeed high-grade copper HGZ8 +0.25% widely used as an industrial metal in manufacturing buildings and electronics at $2.758 a pound on Tuesday is down 16.5% on the year and about 1.7% so far in October. The metal is on track to register losses in five of the past six months and seven of the past nine.,,,,,
,,Tension has been escalating between the Republican and Democratic parties in light of Supreme Court Justice Brett Kavanaugh’s confirmation to the court as well as immigration health care and other social issues.,,,,,
,,The working paper “Computer Vision and Real Estate: Do Looks Matter and Do Incentives Determine Looks” was based on research by noted housing scholar and urbanist Ed Glaeser of Harvard University and two associates.,,,,,
,,Capitol Report: New White House report echoes Trump’s campaign rallies in attacking socialism,,,,,
,,“Crude oil has been declining on concerns over excessive supply in the months ahead with the risk-off tone stemming from the equity markets also not helping the cause” said Fawad Razaqzada technical analyst at Forex.com.,,,,,
,Tesla shares TSLA +12.72% traded as high as $288.80 their highest since Oct. 4 and were the second best performer on the Nasdaq-100.,,,,,,
,,If you have a question for Dan please email him with “MarketWatch Q&A” on the subject line.,,,,,
,I think there is retiring forward and retiring backward. Suze did what many early retirees do. She left her day job. She got rid of excess not needed in a post-job life. For most it’s getting rid of the car to impress clients or five suits for a weekly rotation at the office. For Suze it was five cars and five homes.,,,,,,
,,Now read: The real reason marijuana stocks are falling off a cliff — and what to do now,,,,,
There isn’t a readily available breakdown of the CBO’s forecast by income bracket — the CBO said it doesn’t have that information — so for argument’s sake a Joint Committee on Taxation breakdown on the distribution effects of the Tax Cuts and Jobs Act will be used. (That’s not a perfect solution since the JCT breakdown includes more than just income taxes.),,,,,,,
,“The issue lately is that while there have been pockets of positive action around each day has had its culprits. On Monday the financials’ big drop diluted the market’s attempt to bounce. On Tuesday the S&P 500 was able to mount a substantial turn around but this time energy was the obvious laggard” he said. “So today’s breach of the lows could end up marking a key trading low but I think the price action shows that the trading environment remains fragile and stocks [are] easily pushed around.”,,,,,,
,,Meanwhile Warren Buffett once said that Wall Street analysts “make fortune-tellers look good.” So while in Salem I stopped by one of the town’s psychics to see if he could tell me where the stock market was headed. I’ve been following people on Wall Street for twenty years and none of them has a clue.,,,,,
,He pointed to several divergences that should make clear to investors just how precarious the market situation is at these current levels. The first one is what we’re seeing in this chart of the S&P vs. the rest of the world.,,,,,,
,But “plain and simple -- Tesla is destroying the competition” it said. “It looks like it is the competition that is taking the Ambien” referring to Musk’s admission that he sometimes uses the sleeping pill.,,,,,,
,Read more: Here’s how much Tesla lost in market cap now that Musk’s SEC settlement is approved,,,,,,
,,There is a broader implication to this discussion. Because the “aggressive” label doesn’t just come up in informal discussions but also appears in performance reviews it can have a major impact on careers.,,,,,
,,This is not the first doctor to effectively recommend walking your way to a longer life. Walking at an average pace was linked to a 20% reduction in the risk of mortality compared with walking at a slow pace according to a study published earlier this year in the British Journal of Sports Medicine. A similar result was found for risk of dying from cardiovascular disease.,,,,,
,,Fears that a slowdown by China’s economy will eventually ripple through the rest of the world were playing out on Tuesday reflected in a sweeping global equity-market downturn.,,,,,
,,Those efforts come as the Beijing and the U.S. remain locked in a trade dispute that many analysts feel is reverberating through China and U.S. markets. Underperformance of cyclical sectors relative to their defensive peers around the world since global equities started to fall back last month likely reflects investor worries about the growth outlook for both China and the U.S. wrote economists at Capital Economics.,,,,,
When it comes to raking in “mailbox money” residents of some cities are doing better than others. In some cases much much better.,,,,,,,
,Pot stocks fall again as Aurora Cannabis sinks on NYSE debut,,,,,,
,,The Puritans tried to burn the witches out of Salem but their stunt had the opposite effect. Thanks to the publicity the place is now Witch Central. Occult stores and magic shops crowd the Victorian town’s narrow side streets selling artifacts crystals mysterious powders and books on tarot cards.,,,,,
,"Among the more-active stocks Aurora Cannabis Inc.ACB -11.39%

    
ACB -11.73%

    made its debut on the New York Stock Exchange moving over from the OTC Markets. The reception wasn’t too festive however as the stock dropped 7.9%. Trading volume was heavy at 30.4 million shares enough to make it the seventh-most active stock on the NYSE.",,,,,,
,,"I can’t tell you to sell or not. You have no doubt seen the wild ride the Dow Jones Industrial DJIA -0.50%

     and S&P 500 SPX -0.55%

      has had over the last few weeks.",,,,,
,,• You have some evidence (e.g. documents or behavior) that backs up your story,,,,,
,,Providing critical information for the U.S. trading day. Subscribe to MarketWatch's free Need to Know newsletter. Sign up here.,,,,,
,,My sister is on disability so eventually we will need to sell my mother’s assets to give her money to live on. Once my mom’s dementia got worse I did become a co-trustee with financial power of attorney.,,,,,
,,Perhaps predictably one key Trump ally was said to be delighted with the president’s word choice:,,,,,
,“I’m telling you I just did it for three years on my private island. I retired at 65. I shut down the Suze Orman show. I sold five homes. I got rid of five cars. I stopped going on QVC. I stopped writing for Oprah’s magazine. I stopped giving talks. I stopped doing everything and I had a great time for three years. I learned how to fish. I learned how to win tournaments. I learned how to be the captain on my boat. and all of a sudden it was like “Oh there’s still stuff for me to do.” Now. I was in a field that everybody welcomed me back when I came back. They were excited to see me in the halls of NBC and MSNBC and everywhere that I went this past week.”,,,,,,
,,If someone misses the deadline for a legitimate reason however there is wiggle room available because the IRS allows them to self-certify their eligibility for an extension. Let’s take a closer look at the options available to complete a valid rollover after the 60-day period has expired.,,,,,
,,"Social-media peer Twitter Inc. TWTR -1.41%

     struggled for years but it began to earn Wall Street’s respect when it posted its first profitable quarter in February. The company still has user-growth issues but it’s doing a better job of monetizing the existing user base and selling higher-quality ads.",,,,,
,,And sooner or later that sort of double-dealing tends to catch up.,,,,,
,,"In May Nestle NESN +5.00% the world’s largest food and drinks group paid Starbucks CorpSBUX -0.15%

      $7.1 billion to sell its coffee products such as Nespresso after activist investor Dan Loeb pressured the company to boost its margins.",,,,,
,,Heart patients spend most of their waking hours sitting lying down but remaining sedentary for long periods could shorten their life research suggests. Taking breaks and burning more than 770 calories per day should help prolong their life said Ailar Ramadi postdoctoral fellow in the Faculty of Rehabilitation Medicine at University of Alberta Edmonton and author of the latest paper.,,,,,
Compare that kind of price tag with the estimated $25 billion cost of a Trump border wall that has gotten nowhere in Congress. Legislation proposed by House Majority Leader Kevin McCarthy would provide a slightly slimmer $23.4 billion.,,,,,,,
