Texto,Texto,Texto,,,,,
,,Among them: “as a seller you have to be driving the process. That’s difficult. Folks that are selling their homes have busy lives and jobs and sometimes more than anything you rely on a Realtor to just keep the process moving forward.”,,,,,
,,“We don’t understand the reason why the USCICS is not giving any recognition to those awards and the fact that they are the 2018 U.S. Junior National Champions and denying Christina the ability to represent the United States at the next Olympic Games.”,,,,,
,Disclosure: Subscribers to The Arora Report may have positions in the securities mentioned in this article or may take positions at any time. Nigam Arora is an investor engineer and nuclear physicist by background who has founded two Inc. 500 fastest-growing companies. He is the founder of The Arora Report which publishes four newsletters. Nigam can be reached at Nigam@TheAroraReport.com.,,,,,,
,,Revenue: The FactSet consensus calls for revenue of $282.8 million up from $207.9 million in the year-earlier period. Snap forecast revenue of $265 million to $290 million. According to Estimize which crowdsources estimates from hedge-fund managers academics and others Snap is expected to show sales of $281.2 million.,,,,,
,,Would you like to sign up to an email alert when a new Moneyist column has been published, If so click on this link.,,,,
Next came Bridgeport-Stamford-Norwalk Conn. where the average income from dividends and qualified dividends were $23800 and $19300 respectively.,,,,,,,
,,The board approved a five-year fiscal plan Tuesday the Post said. The plan projects that $82 billion in anticipated federal disaster funds will bolster the U.S. territory’s economy better positioning it to pay off debts in the future.,,,,,
,On the positive side you are seeing the first pointer given in “How to potentially become a marijuana millionaire albeit carefully” coming into play. Astute marijuana investors will take advantage of the drop and may end up making money in the long run. Let’s explore the real reason for the decline in marijuana stocks with the help of a chart.,,,,,,
,So you must positioning yourself for that tasty bounce we’ve grown accustomed to over the course of this stubborn bull market. Well don’t warns J.C. Parets the technical analyst behind the All Star Charts blog.,,,,,,
,,SALEM MASS. — Where better to explore the connection between witchcraft and Wall Street than this spooky old New England town, It’s been linked to the occult since the witch trials of the 1690s and now hosts so many psychics mystics and fortune-tellers that they are licensed and regulated by city ordinance.,,,,
,,One of the most surprising outcomes of Fischer’s experience may be that the offer she accepted came from a buyer represented by a Realtor - meaning she and Andrew paid that broker’s 3% fee. “There was just a little bit of a comfort level” with knowing that the buyer had been vetted by a professional Fischer told MarketWatch even though ShowPal will also help with that part of the process. Even after paying that commission Fischer estimates the family saved nearly $9000 in the transaction and hundreds more at closing.,,,,,
,,The first thing you should consider is simplicity. If you’re happy with your current employer’s 401(k) it will be simpler for you to roll everything into your current 401(k) plan. A good plan has a variety of investment options and low fees.,,,,,
,,Have breaking news sent to your inbox. Subscribe to MarketWatch's free Bulletin emails. Sign up here.,,,,,
,,Also read: FEMA director denies he was asked to resign questions Puerto Rico death toll.,,,,,
,,President Trump is credited by foes and fans alike with a capacity not only to attract attention at will but to trigger the reaction he desires whether ire or ardor distraction or elation. Even close observers are at times left wondering precisely what they’ve heard and seen and how they should respond.,,,,,
Suze Orman did a smackdown of the FIRE (Financial Independence/Retire Early) movement on Paula Pant’s podcast. She said she “hates it hates it hates it.” Interesting since her publicist asked Paula for the interview as well as asking this of other FIRE podcasters in order to push Suze’s new book products and events. Talk about inviting yourself to dinner and then complaining about the food!,,,,,,,
,,What Trump’s tweet about your retirement plan really says is: if Democrats get control of Congress they’ll repeal his tax reform which will hurt the economy employment and wage growth said Allan Katz founder of Comprehensive Wealth Management Group in Staten Island N.Y. “His tweets are calculated” Katz said. “He knows what he’s trying to accomplish and it has nothing to do with your 401(k) but the midterm election.”,,,,,
,Elsewhere Italy was told to revise its budget by the European Commission on Tuesday according to news reports as the jostling between the country’s antiestablishment government and Brussels persists.,,,,,,
,,Facebook released its “Ad Archive Report” on Tuesday saying it’s part of its efforts to “increase transparency in advertising.” The Silicon Valley company is making changes after getting criticized this year for how groups used its platform during the 2016 U.S. presidential campaign.,,,,,
,Opinion: Suze Orman missed the point of retirement and that’s why she went back to work,,,,,,
,Analysts polled by FactSet expect Tesla to report an adjusted loss of 3 cents a share on sales of $6.01 billion. That would compare with an adjusted loss of $2.92 a share on sales of $2.99 billion in the year-ago period.,,,,,,
"Other chip-related companies reporting earnings this week include Silicon Laboratories Inc. SLAB -1.32%

     on Wednesday and Cypress Semiconductor Corp. CY -1.50% Entegris Inc. ENTG +0.19%

     and Monolithic Power Systems Inc. MPWR +0.45%

     on Thursday.",,,,,,,
,,Those taking tanezumab meanwhile reported statistically significant improvements on three different measures of their condition including pain and physical function as compared with the placebo.,,,,,
First place was the Naples Fla. area. Nearly 30% of the tax returns from that area show capital gains and the average reported from those gains was just under $97000 SmartAsset found.,,,,,,,
,,The lawsuit lists a number of defendants that include Alibabacoin Foundation aka ABBC Foundation, ABBC Block Chain IT Solutions LLC, Alibabacoin General Trading FZE, Alibabacoin Foundation LLC and Jason Daniel Paul Philip and Hasan Abbas the founders of the company.,,
,,After sharing some details pushing some stones around on a table shuffling a deck of cards and thinking deep thoughts I got to ask one question.,,,,,
Adding to trade war concerns a recent Morgan Stanley survey of chip distributors found that oversupply indicators currently look worse than those encountered in the sectors last big down turn in 2015.,,,,,,,
,,Down an alley I found a magic store offering readings. At the back behind the bric-a-brac I crossed a man’s palm with silver (actually with green paper) for a quick reading on tarot cards. Anyone expecting a mysterious levitating genie in a flowing robe would be disappointed. He was a bald dude who didn’t look noticeably different from your average New England Patriots fan.,,,,,
A 10% reduction then would cost $174 billion for one year or $2.24 trillion over a decade.,,,,,,,
,,If the first step is admitting there’s a problem Snap has done as much. In a detailed memo leaked to Cheddar Chief Executive Evan Spiegel told employees that he rushed the recent Snapchat redesign and discussed his ambitious goal of reaching profitability in 2019.,,,,,
,,“And in light of our forecasts that China’s economy will continue to lose momentum and that the U.S. economy will slow sharply in 2019 we expect them to continue to underperform” they said in a Tuesday note. “This would be consistent with what has happened in previous economic downturns.”,,,,,
,,In his latest tweet about 401(k) plans on Sunday the president touted the “best jobs numbers in the history of our great country” and said Democrats could never do nearly as well. “So why wouldn’t we win the Midterms” he said. “Think of what will happen to your now beautiful 401-k’s!”,,,,,
,,The returns for the other six months of the year from May to October, Just 2.1%. No kidding. That as the authors dryly note was less than you could have earned on average in the bank.,,,,
Taxable interest income is defined as money people earned from savings accounts and certificates of deposit. Dividends are from ownership of stocks, qualified dividends are those people have owned long enough to meet the IRS’s holding period qualification. And capital gains income is the money earned by selling assets including stocks and bonds.,,,,,,
An important pointer for investors to carefully make millions in marijuana stocks is to learn how to properly size their positions and how to build the position sizes correctly.,,,,,,,
,,Hello there MarketWatchers. Check out the Moneyist private Facebook group where we look for answers to life’s thorniest money issues. Readers write in to me with all sorts of dilemmas: inheritance wills divorce tipping gifting. I often talk to lawyers accountants financial advisers and other experts in addition to offering my own thoughts. I receive more letters than I could ever answer so I’ll be bringing all of that guidance — including some you might not see in these columns — to this group. Post your questions tell me what you want to know more about or weigh in on the latest Moneyist columns.,,,,,
,,In a recent interview with Russian news agency TASS that also served to keep a lid on oil prices Monday the Saudi energy minister Khalid al-Falih said Saudi Arabia would increase crude production to 11 million barrels a day compared with its current average of 10.7 million barrels a day. Al-Falih said his job was to implement the government’s “constructive and responsible role” in stabilizing the world’s energy markets.,,,,,
,Mike O’Rourke chief market strategist at JonesTrading said that Caterpillar and 3M earnings are providing evidence that the twin headwinds of rising inflation and the effects of new tariffs are starting to take a bite out of profits. “Caterpillar citing rising costs shows that the trade war is hitting home” he said. “It’s industrials like Caterpillar that struggle when you’re at a cyclical top” he added suggesting that the stock’s struggles don’t bode well for the market going forward.,,,,,,
,,I have no clue what these long-term bonds are doing in this portfolio. Was this a poor decision which will definitely result in losses if we sell the bonds before the end of the coupon date, Everything is set up as a trust with shares to be divided equally between my sister and I upon my mother’s passing with a percentage distributed to my children.,,,,
,,The awards “were not directly awarded to you” the August decision said. “They were awarded for your performance as part of a sports team…[W]e do not consider such honors to be a nationally or internationally recognized prize or award for excellence in the field of endeavor because it is limited to members of that association and participants of those competitions.”,,,,,
,,This mother has a similar dilemma to you. She wants to give her daughter every advantage too but her family had experienced generations of poverty. She has nothing. In some ways instilling opportunity and ambition and wonderment in a child costs the price of a library card and your time. This woman reached out to Reddit and users on that site told her to visit a library at least once a week go places that don’t cost money read together as a family and often.,,,,,
,,Pfizer shares have surged 18% over the last three months and Eli Lilly shares have surged 23% compared with a 3.3% decline in the S&P 500 SPX -0.55%,,,,,
,,While several U.S. lawmakers have called for exploring possible sanctions on Saudi Arabia the Trump administration has been seen as reluctant to pursue measures particularly as renewed sanctions on Iran take full effect next month.,,,,,
,He laid out some more troubling divergences but you get the idea. Parets who was much more bullish on stocks over the summer now sees a crash on the horizon and he recommends investors lighten their equity load.,,,,,,
Another divergence we haven’t seen since the 2015 top and before that the 2007 top is the relationship between consumer staples and the broader market.,,,,,,,
,,"DJIA -0.50%

    On Monday Dow industrials and the S&P 500 closed lower while the Nasdaq bucked the trend to edge higher.",,,,,
,,See: Snap stock volatile after first quarterly guidance and user decline,,,,,
,,Providing critical information for the U.S. trading day. Subscribe to MarketWatch's free Need to Know newsletter. Sign up here.,,,,,
,Despite the pot-stock sector selloff a study on the American consumer conducted by GfK MRI in collaboration with Miner & Company Studio estimates that over 38 million U.S. adults or 16% of the adult population use marijuana with 10% of the population consumer it at least once a month and 4% using on a daily basis.,,,,,,
Tesla Inc. stock rallied more than 9% Tuesday after famed short seller Citron Research turned long on it saying that the Model 3 is “a proven hit” and that many of the “warning signs” about the Silicon Valley car maker have proven to be insignificant.,,,,,,,
,,You make the call.,,,,,
,,"China’s downturn appeared to spark a global equity selloff that saw European shares fall and U.S. stocks decline with the Dow Jones Industrial Average DJIA -0.50%

     falling 548 points at its session low before paring losses to end around 126 points lower a decline of 0.5%. The S&P SPX -0.55%

     fell 0.6% Tuesday.",,,,,
,,They are preparing to update their paper to include dramatically expanded research.,,,,,
I think there is retiring forward and retiring backward. Suze did what many early retirees do. She left her day job. She got rid of excess not needed in a post-job life. For most it’s getting rid of the car to impress clients or five suits for a weekly rotation at the office. For Suze it was five cars and five homes.,,,,,,,
Related:  Tesla’s sales in the U.S. are gaining on BMW and other luxury car makers,,,,,,,
,,Do you have questions about inheritance tipping weddings family feuds friends or any tricky issues relating to manners and money, Send them to MarketWatch’s Moneyist and please include the state where you live (no full names will be used).,,,,
,For myself post-FI life has thrown plenty my way. Cancer. The death of a partner. Homeowner miseries like a flooded basement failed siding and carpenter ants. But none of this has thrown me. I find that much of what happens in early retirement can be addressed fairly easily through a combination of building close relationships with family and friends insurance a prudent stash in a money-market fund level-headed and lower-cost choices a MacGyver DIY knack and some gigging.,,,,,,
,,It wasn’t the riskiest or the most exciting thing to do with her lump sum especially given her family’s history with reckless investments and more than a dash of bad luck but it was the smartest. “I collect rent from some apartments I own in the city” she told me. “That allows me to be an author and focus much of my attention on writing. It’s been a journey learning about finance and real estate and being independent. I had to figure it out on my own.”,,,,,
Third-quarter results arrive nearly three weeks after Musk took swipes at the Securities and Exchange Commission and at short sellers by calling the SEC the “Shortseller Enrichment Commission.”,,,,,,,
,,Meanwhile China has been readying a fresh round of monetary and fiscal stimulus to help support its economy and its stock market with the government recently announcing plans for boosting bond financing for private firms and cutting taxes for households.,,,,,
"The hardest hit chip stocks in October have been Nvidia Corp. NVDA -4.39% and Advanced Micro Devices Inc. AMD +0.24% which are down 21% and 19% respectively in the month to date. They are followed by shares of Micron Technology Inc. MU -2.72%

     and Microchip Technology Inc. MCHP +0.58% which are both down around 15% for the month.",,,,,,,
,,I own two other properties my primary residence and a vacation home and my work income is sufficient to live on without the rental income. (I travel a lot and use some of the rental income for that and invest whatever is left.) I am semi-retired at the age of 60 and plan to fully retire in two years. I have a number of retirement accounts including traditional SEP and Roth IRAs and have no debt.,,,,,
“The Fed the Trump the ebola or whatever excuse du jour is being regurgitated on the various media outlets” Parets wrote. “The only one to blame is ourselves.”,,,,,,,
,,Dear Moneyist,,,,,
,,If a taxpayer’s family member dies they may be granted a waiver. As an illustration in one case a taxpayer’s husband died after taking money out of his IRA and transferring it to a personal bank account. While managing her husband’s estate she realized a rollover had not occurred and the 60-day window had passed. In this case the IRS allowed the taxpayer to complete the rollover notwithstanding the fact that the 60-day period had expired. In other cases the state of mind of the mourning taxpayer was considered in allowing a valid rollover after the 60-day period.,,,,,
,,The case follows an attempt in April which was denied on the grounds that “Alibaba has not met its burden to establish a reasonable probability that the Court has personal jurisdiction over Alibabacoin” which is listed as being based in both Dubai and Belarus.,,,,,
FIers might travel to exotic places. For some it’s backpacking. For Suze it was living on her private island.,,,,,,,
,,Usually when someone digs up a strategy or anomaly like this all the world jumps into it and the advantage gets traded away. But not this time. “It seems to defy economic gravity” they write. “It does not disappear or reverse itself as theory dictates it should… The fact that trading on this strategy is particularly simple makes its continued existence even more surprising.”,,,,,
,,Don’t miss: Should we hide our Silicon Valley wealth from our children,,,,,
According to the Congressional Budget Office the U.S. will collect $1.74 trillion in individual income taxes in the current September-ending fiscal year and $22.38 trillion over a decade.,,,,,,,
Tesla surprised markets on Monday by setting the date for its third-quarter results about two weeks earlier than its usual date. Tesla did not return a request for comment from MarketWatch late Monday about the decision to fast-forward earnings with little notice.,,,,,,,
,Tesla Inc. stock rallied more than 9% Tuesday after famed short seller Citron Research turned long on it saying that the Model 3 is “a proven hit” and that many of the “warning signs” about the Silicon Valley car maker have proven to be insignificant.,,,,,,
Musk has vowed to show profits in the third and fourth quarters.,,,,,,,
,,I would like her to go to private school but we can’t afford that either. But she could. I am really torn.,,,,,
,,Mike O’Rourke chief market strategist at JonesTrading said that Caterpillar and 3M earnings are providing evidence that the twin headwinds of rising inflation and the effects of new tariffs are starting to take a bite out of profits. “Caterpillar citing rising costs shows that the trade war is hitting home” he said. “It’s industrials like Caterpillar that struggle when you’re at a cyclical top” he added suggesting that the stock’s struggles don’t bode well for the market going forward.,,,,,
,Read MarketWatch’s interview with Vicki Robin,,,,,,
,,"Whitbread PLCWTB -1.52%

      said it would distribute a significant amount of the proceeds from the sale to shareholders.",,,,,
,,Providing critical information for the U.S. trading day. Subscribe to MarketWatch's free Need to Know newsletter. Sign up here.,,,,,
,• In marijuana-related stocks smart money flows are negative for GW Pharmaceuticals GWPH +2.53% Scotts Miracle-Gro SMG -2.99% and Constellation Brands STZ -1.95%,,,,,,
,,Fair warning: using the self-certification process may be an audit trigger for the IRS. However you should be fine if:,,,,,
,Coach Carson posted a balanced informative response appreciating Suze’s admonition to be sure you have enough for a risk-free retirement. Suze enumerated a string “what can go wrong” scenarios as evidence that early retirement (on less than $10 million) leaves you vulnerable when life hands you lemons — a whole tree of lemons. He — and MMM — responded evenhandedly but ultimately here’s what Carson said she got wrong:,,,,,,
,,Thanks Phil,,,,,
,,Investors betting on a Snap Inc. turnaround don’t have to look far for inspiration.,,,,,
,,One top-ranked Canadian-born ice skater wants to bring America the gold but immigration authorities say she’s not special enough to deserve a path to citizenship.,,,,,
,,In short the researchers found looks do matter. And yes incentives also play a role — but our understanding of them may be fuzzy.,,,,,
The short seller had long held that by the time of the Model 3’s arrival “multiple” 200-mile range electric vehicles would have been on the market it said Tuesday.,,,,,,,
,In March it predicted the stock would fall to $100 by year’s end. Citron’s Andrew Left is also among the several investors and short sellers who have filed class-action lawsuits against Tesla for alleged securities law violations stemming from Chief Executive Elon Musk’s going-private tweets in August.,,,,,,
,,As a general rule rollovers will not be accepted by a financial institution after the 60-day rollover period has expired. If however you use the boiler plate document from the appendix of Revenue Procedure 2016-47 and give this short form to the trustee of the company to which you are rolling your funds then the financial institution will treat the distribution as a qualified rollover. In addition to using the form you should complete the rollover as soon as possible (there is a 30 day safe-harbor-period after the reason for the delay no longer prevents the taxpayer from making the contribution).,,,,,
,,During the interview he also said the Saudis want to sign a new cooperation agreement that is “open-ended” with no fixed term which would allow the Organization of the Petroleum Exporting Countries and non-OPEC countries to lift or lower production as needed to balance the market.,,,,,
,,He sees real estate as no different than other behemoth markets that are now being dragged into the 21st century like car-sharing and short-term home rentals have been upended by Uber and AirBNB. And for now there are still opportunities for real-estate agents to offer their services on a contract basis for ShowPal transactions.,,,,,
,,The White House maintains that if the United States implemented policies similar to those in place in Nordic countries in the 1970s American families earning the average wage would be taxed $2000 to $5000 more per year net of transfers. The report concludes U.S. GDP would decline by about $11000 per year per person if 1970s-style Nordic policies were in place and by $24000 per year if “highly socialist” policies were in place.,,,,,
,,Dear Concerned,,,,,
,,Only after a series of searching conversations can an adviser create a truly comprehensive financial plan. Better yet the savvy adviser guides the client to stay on track and make needed adjustments to attain goals.,,,,,
,Check out: MarketWatch’s comprehensive coverage of the cannabis sector including profiles of a number of key players in one place.,,,,,,
,,Taxable interest income is defined as money people earned from savings accounts and certificates of deposit. Dividends are from ownership of stocks, qualified dividends are those people have owned long enough to meet the IRS’s holding period qualification. And capital gains income is the money earned by selling assets including stocks and bonds.,,,,
,,U.K. leisure group Whitbread is set to sell Costa Coffee chain to U.S. soft-drinks maker Coca-Cola for roughly £4bn (or $5.2 billion).,,,,,
,,If your principal residence was damaged you may be able to receive a waiver (e.g. your house was damaged during the 60-day period by a hurricane). An important note about this provision is that damage to one’s home may not be enough to grant a waiver in and of itself. It would be helpful to show that the damage actively prevented you from completing the rollover.,,,,,
,,“For-sale-by-owner is not for everybody” Torstenson told MarketWatch “but if we were able to solve some of the friction points and educate the community that they can do it empower them to do it then we said this needs to happen in the real estate market.”,,,,,
,,Not everyone agrees that your husband paying off your mortgage is a problem. “It will likely be water under the bridge unless he could really prove you orchestrated the depletion of his separate property” says Randy Kessler an Atlanta-based lawyer and author of “Divorce: Protect Yourself Your Kids and Your Future.” Kessler doesn’t advise against it. “You’d be in a better position than if the money was still in his separate account.” Again my caveat: It may not go your way.,,,,,
