Texto,Texto,Texto,,,,,
,,"West Texas Intermediate crude for December delivery CLZ8 -0.06%

     on the New York Mercantile Exchange fell $2.93 or 4.2% to settle at $66.43 a barrel. That was the lowest settlement since Aug. 20. December Brent crude LCOZ8 -4.50% the global benchmark was off $3.39 or nearly 4.3% to $76.44 a barrel on the ICE Futures Europe exchange for the lowest finish since late August.",,,,,
,FIers might travel to exotic places. For some it’s backpacking. For Suze it was living on her private island.,,,,,,
,,Trump at campaign rallies has been saying that Democrats will turn the U.S. into Venezuela if they take power.,,,,,
,“Given the high degree of cyclicality in both tech and consumer discretionary we think their derating should be more in line with the broader S&P 500 or another 6-8%” he said.,,,,,,
,,Others are less certain that Snap can pull off a rebound. “Although Twitter pulled off a similar miracle call us skeptical as — despite the memo — we don’t have faith in Snap’s leadership to navigate these rapids” MoffettNathanson’s Michael Nathanson wrote in a recent report. Nathanson has a neutral rating and $6.50 target on the shares.,,,,,
,,"(News Corp NWS -1.27%

      owner of MarketWatch operates realtor.com under license from the National Association of Realtors.",,,,,
,,Divergence between the performance of U.S. stocks and rest of the world also has been cited as evidence to support the notion that China’s woes are infecting global markets outside of the U.S.,,,,,
,,"As investors backed away from perceived riskier assets such as stocks they sought a haven in the Japanese yenUSDJPY -0.03% Gold prices GCZ8 -0.25%

    settled higher while oil futures US:CLX8

     slumped.",,,,,
,,Do you have questions about inheritance tipping weddings family feuds friends or any tricky issues relating to manners and money, Send them to MarketWatch’s Moneyist and please include the state where you live (no full names will be used).,,,,
"Tesla shares have lost 11% this year and 18% in the last 12 months. That compares with gains of 1.4% and 0.9% for the S&P 500 index SPX -0.55%

     and the Dow Jones Industrial Average DJIA -0.50%

     in the same period.",,,,,,,
,,I find this topic to be profoundly troubling.,,,,,
,,I paid $150000 for the duplex and spent about $55000 on updates and renovations. A real estate agent has suggested selling it for $565000 as a duplex or converting it to condominiums and selling each for $300000.,,,,,
Investors may want to take advantage of the technique we often use at The Arora Report to double returns and lower risks. In this technique core positions are built by scaling into select stocks in the buy zones for the longer term. Then the long-term positions are surrounded by short-term trades in an opportunistic manner.,,,,,,,
,Citron acknowledged its long-held bearish view on Tesla and its surprising turn: “As much as you can’t believe you are reading this we can’t believe we are writing this!”,,,,,,
,,Fourth you can avoid any problems with the 60-day issue by using a direct rollover or a trustee-to-trustee transfer. In many cases this is the best way to transfer funds anyway.,,,,,
,,President Donald Trump on Tuesday called Saudi Arabia’s handling of the killing of a journalist one of the worst cover-ups in history as he admitted he didn’t have proof that Middle Eastern criminals were in a migrant caravan and defended his use of tariffs against other nations.,,,,,
,,Late Tuesday Trump speaking during a so-called pool spray in the Oval Office said the term nationalist should be brought back but suggested he was unfamiliar with the reasons it’s heard so rarely in open public discourse.,,,,,
,,That said I can answer your question with some more questions. Currently you’re roughly getting a 8% rate of return on your original investment on each unit or 19% on both when taking into account your purchase price renovations and other annual costs. That’s not bad at all given that your property will likely continue to increase in value. That’s slightly more than the 7.2% rate of return you would receive if you had 40% of your 401(k) account in stocks and 60% in fixed income.,,,,,
,,Pledged-share collateral financing “is not small with estimates ranging from $550 billion to $600 billion” equal to 10% to 12% of total A-share market cap wrote Sean Darby chief global equity strategist at Jefferies in a note. A-shares are stocks of Chinese companies incorporated on the mainland and listed in Shanghai and Shenzhen.,,,,,
,,Don’t miss: At a time of market volatility beware of rogue advisers who play on your fears,,,,,
,,Attorneys representing both Alibaba and AlibabaCoin Foundation didn’t immediately return requests for comment.,,,,,
,Indeed the simple life is one of the lures of early retirement.,,,,,,
Read: 16 tech stocks that stand to close at new 52-week lows,,,,,,,
,Among other signs O’Hara pointed to the National Association of Active Investment Managers’ survey which showed that managers reduced their exposure to equities to 58% last week. Since 2016 a reading in the vicinity of 60% has led to managers adding to their positions.,,,,,,
Coach Carson posted a balanced informative response appreciating Suze’s admonition to be sure you have enough for a risk-free retirement. Suze enumerated a string “what can go wrong” scenarios as evidence that early retirement (on less than $10 million) leaves you vulnerable when life hands you lemons — a whole tree of lemons. He — and MMM — responded evenhandedly but ultimately here’s what Carson said she got wrong:,,,,,,,
,Ask Arora: Nigam Arora answers your questions about investing in stocks ETFs bonds gold and silver oil and currencies. Have a question, Send it to Nigam Arora.,,,,,
,"DJIA -0.50%

    On Monday Dow industrials and the S&P 500 closed lower while the Nasdaq bucked the trend to edge higher.",,,,,,
,,Do you have questions about inheritance tipping weddings family feuds friends or any tricky issues relating to manners and money, Send them to MarketWatch’s Moneyist and please include the state where you live (no full names will be used).,,,,
,Mr. Money Mustache did an excellent job of correcting her misimpressions of what we all are up to with saving and investing money early in life so we can be free to pursue what matters more than money. I don’t have anything to add to his explanation.,,,,,,
Related: White House’s Kudlow says new tax cuts in ‘planning stage’,,,,,,,
,,Should we use any of her money for her extra-curricular activity, For example summer camps (which can range from $200 a week to $2000), Dance class, Gymnastics, We have not done this. We are not rich people. In fact we are decidedly middle class. And I don’t want her to miss out on things that I feel will benefit her as a person overall.,
,,Trump threatens to cut foreign aid over migrant caravan’s progress,,,,,
,The research also showed that 55% of users consume it for recreational purposes while 15% of users consume it for medical reasons. Of the total 29% said they use it for both purposes.,,,,,,
,,To uncover your clients’ aspirations and goals you need to devote more time to getting to know them. And that means boosting your productivity so that you squeeze more value from every hour of the day.,,,,,
,,Have breaking news sent to your inbox. Subscribe to MarketWatch's free Bulletin emails. Sign up here.,,,,,
,,I offer up this juicy story: In 1996 a California woman won $1.3 million in the lottery and filed for divorce 11 days later. She didn’t tell her husband about her windfall and two years later her husband found out all about it and sued her. Superior Court Judge Richard Denner ruled did not appreciate her shenanigans and awarded her husband all of her winnings. If a judge suspected you were planning to divorce when your husband made these payments your plan could also backfire. Any good divorce lawyer would balk if he saw such payments prior to a divorce.,,,,,
,,Read: The stock market faces ‘unlimited downside risk’ warns veteran trader,,,,,
,,Even less heroic calculations including obscure and illiquid markets yielded returns of 6.6% for the six months following Halloween and 1.7% a year for the other half of the year.,,,,,
,,Don’t miss:  Advisers say most investors can breathe easy despite wildly unpredictable markets,,,,,
,,“We don’t think the value proposition of a Realtor is zero. We think it’s approaching zero but it’s not zero yet” Torstenson added.,,,,,
,The first pointer given in How to potentially become a marijuana millionaire albeit carefully is to expect these stocks to be very volatile. Here is the second pointer: “Investors may want to take advantage of the volatility by selling into the strength and buying into the weakness.”,,,,,,
,,Heart patients should move around every 20 minutes during an eight-hour period of sitting according to a paper presented on Saturday at the Canadian Cardiovascular Congress in Toronto an event where visiting experts from the European Society of Cardiology participate in joint scientific sessions with the Canadian Cardiovascular Society.,,,,,
,,Overall the Shanghai Composite has lost 27% of its value since hitting a peak on Jan. 24 while the small-capitalization focused Shenzhen has declined by 34% since its late-January apex according to FactSet data. That means both benchmarks are deep in bear-market territory defined as a drop of at least 20% from a recent peak.,,,,,
,,Poor Parent with Rich Daughter,,,,,
,,"Regeneron Pharmaceuticals Inc. REGN -1.83%

     and Teva Pharmaceutical Industries Ltd. TEVA +0.05%

     are also developing another one of this class of drugs called fasinumab which also targets a protein called nerve growth factor to reduce pain. The companies announced results from a phase 3 trial in August and said they plan to advance the program.",,,,,
,,Check out: MarketWatch’s package of tariff-related stories,,,,,
,,I live in another state and think this broker got her in these bonds with the lure of a good rate (around 4.5%) but his paperwork shows nothing about commissions either. My sister — who lives with my mom — also trusts this man and never questioned what he was doing.,,,,,
,,• An individual relies on the financial institution for either advice or services,,,,,
,Opinion: The real reason marijuana stocks are falling off a cliff — and what to do now,,,,,,
So you must positioning yourself for that tasty bounce we’ve grown accustomed to over the course of this stubborn bull market. Well don’t warns J.C. Parets the technical analyst behind the All Star Charts blog.,,,,,,,
,,So why did it come out on top, The high percentage of retirees who live there likely pushed Naples over the edge. Some 51% of the population is 65 or older the U.S. Census Bureau found. Florida is one of the five states with the highest median age population along with Maine New Hampshire Vermont and West Virginia.,,,,
,,My 93-year-old mother has dementia. She has used a broker that she and my father basically inherited when their prior broker left the firm. She liked him very much and not being that smart financially I trusted him as well.,,,,,
This can mean time in nature reading meditation and family life. For many who achieve financial independence (FI) compensatory spending — the shopping you do to reward yourself for a tough week at work — disappears. For Suze it was quitting the QVC habit.,,,,,,,
,"After eking out gains last week the S&P 500 SPX -0.55%

     is trading below the 200 DMA of 2768 thus far this week as stocks remain under pressure with third-quarter earnings cycle picking up pace. Both the blue-chip Dow Jones Industrial Average DJIA -0.50%

     and the Nasdaq COMP -0.42%

     slumped and remain below their respective 200 DMAs. Market technicians view moving averages as a dividing line of bullish and bearish momentum in an asset.",,,,,,
,,Get a hold of the summary plan description (SPD). It will tell you if the plan will accept rollovers. Most plans do and you should be able to roll that money out at any time. The SPD will also list out the investment options and the fees.,,,,,
,,“All they have to do is get serious about monetization” said Pachter who rates the stock at outperform with a $12.25 price target and sees signs that the company is making the right early moves. Snap fired its chief financial officer in May and has brought in what Pachter describes as “adult supervision” in other areas of the company.,,,,,
,U.S. stocks bounced off intraday lows and major indexes trimmed early losses Tuesday but the S&P 500 still finished lower for a fifth session as a big drop in the Chinese market revived fresh questions about the global economy.,,,,,,
She said to Paula:,,,,,,,
,,Dear Moneyist,,,,,
,,Should I sell the duplex and invest the sales proceeds or keep the property and continue to collect rent, The recent market volatility has me wondering how I would invest the sales proceeds. The main question is whether I would get a better return by selling the duplex and investing the money or by keeping the property and collecting rent.,,,,
,,My family has a trust fund. My daughter since the day she was born has received dividends. The average is about $8000 per year. She is 10 years old. In order to be fiscally responsible we have set up an account with Edward Jones. Her money is being directly sent there to put in an account. So far it is worth over $100000. I think we are being pretty fiscally responsible.,,,,,
,,"And although U.S. stocks ended well off their worst levels on Tuesday fears that China may prove the catalyst that ultimately upends the global economy are lingering. That sentiment comes after the Shanghai Composite SHCOMP -2.26%

     finished down 2.3% while the Shenzhen Composite Index 399106 -1.92%

    closed 1.9% lower halting a two-day rally that had been underpinned by market-supportive comments from Chinese officials.",,,,,
,,"Shares of Caterpillar Inc.CAT -7.56%

     fell 7.6% after the industrial giant reported profits and revenue ahead of analysts expectations but offered guidance that was below consensus.",,,,,
,,Let the record show that Salem Mass. regulates the kind of advice fortune-tellers are allowed to give more rigorously than the Securities & Exchange Commission regulates forecasters on Wall Street at least as far as stock-market predictions go.,,,,,
,,And so it was with his soliloquy on nationalism in Houston on Monday.,,,,,
And people tend to learn new skills. For most it’s a language or an instrument or home cooking. For Suze it was fishing and tournaments and being a captain of a boat.,,,,,,,
The personal-finance website SmartAsset recently analyzed the finances for citizens of 200 metro areas in the U.S. to find out how much income they’re earning passively through their investments. SmartAsset used Internal Revenue Service (IRS) data to rank those cities based on how much their citizens earn on four investment types: taxable interest dividends qualified dividends and capital gains.,,,,,,,
,,For many industry participants the Multiple Listing Services – there are over 800 all locally owned and operated – may be as ripe for disruption as the role of the agent. “We’re getting closer to a tipping point where the MLS is losing relevance” Daren Blomquist said.,,,,,
,,"Goldman Sachs analyst Heath Terry pointed out that Snap monetizes at 22% the level of Facebook Inc. FB -0.25%

     on a per-minute basis suggesting considerable room for improvement.",,,,,
,,First there are a few exceptions not covered above because of the infrequency with which they occur (incarceration of the taxpayer restrictions imposed by a foreign country and a return to the taxpayer of the proceeds of a federal tax levy).,,,,,
,,Concerned Son,,,,,
,,Related story: Realtors will soon be free of 10-year-old Justice Department decree — so what happens to housing now,,,,,
,She said to Paula:,,,,,,
Don’t miss:  Why the middle-aged ‘dad bod’ could be deadly instead of sexy,,,,,,,
,The question for early retirees is: “To what am I dedicating my freedom,” It’s really not about how many millions you have — Suze’s assertion. Nor how much play you can do before you get bored and go back to your old job.,,,,,
,• What could hurt marijuana stocks, Too much love from investors,,,,,
,,Global Automakers the body which represents foreign auto makers in the U.S. warned in June that a $30000 imported car could see a price rise of $6000 if tariffs on car imports were imposed.,,,,,
,,Being married for 21 years is quite an achievement. I’m sorry to hear that it has come to this. Or that it might come to this. You’re correct. Inheritance is not considered marital property in Ohio so the only way for it to become part of your community property would be to commingle it in some way. That would in theory include renovations on a home or paying off a mortgage. Your husband could still prove that the money came directly from his inheritance assuming he had a good lawyer.,,,,,
,,Talk to the broker. Assuming these bonds don’t mature in 2019 I’d also be concerned. Even if he invested in these bonds when your mother was 83 I’d still be scratching my head over this.,,,,,
,Read: This troubling trend may wreak havoc on the stock market analysts warn,,,,,,
,Wall Street has been struggling with signs that weakness in the second-largest economy in the globe could fuel disruptions in the rest of the global market. Major indexes in Asia fell and sent other markets lower after a second day of remarks from Chinese officials failed to buttress their troubled equity indexes.,,,,,,
,,"Showing requests go out to a pool of real estate agents who’ve agreed to work on a fee-for-service basis and the first agent to respond gets to do the visit and collect the fee. REX also avoids the MLS altogether relying not just on listing aggregators like Zillow Z +1.45%

      and Trulia  but on direct Google searches as well.",,,,,
,,In some of her other recent cases for different employment visas she’s seen rejections for a computer analyst and a mobile app product manager.,,,,,
,How did major benchmarks fare,,,,,,
,,Wall Street has been struggling with signs that weakness in the second-largest economy in the globe could fuel disruptions in the rest of the global market. Major indexes in Asia fell and sent other markets lower after a second day of remarks from Chinese officials failed to buttress their troubled equity indexes.,,,,,
"In October alone the PHLX Semiconductor Index SOX -0.53%

     has dropped 10.2% leading other indexes in a general market rout attributed to rising interest rates and trade war fears. In comparison the Dow Jones Industrial Average DJIA -0.50%

     is down 4.8% for the month the S&P 500 index SPX -0.55%

     is down 6% and the tech-heavy Nasdaq Composite Index COMP -0.42%

      is off 7.6%.",,,,,,,
Until recently buying by the momo crowd was much stronger than selling by the smart money. In a prior Morning Capsule we said: “A big difference from the past is that the momo crowd is not aggressively buying marijuana stocks.”,,,,,,,
,,Read: Now Zillow won’t just show you a home — it will sell it to you,,,,,
"Late Tuesday Texas Instruments Inc. TXN +0.53%

     shares dropped in the extended session after the chip maker beat Wall Street expectations on quarterly earnings but not on revenue’s but did not when it came to revenue or the fourth-quarter outlook. It was the same story for MKS Instruments Inc.MKSI -1.46% which makes testing equipment for chip makers and healthcare tech companies and shares dropped after hours.",,,,,,,
,,In addition some relief may be available when the financial company gives you bad advice regarding a rollover. For instance the 60-day requirement was extended when a bank employee messed up and told a taxpayer that he could not use a rollover because he was over age 59½.,,,,,
,,Carreira’s lawsuit filed Sunday in District of Columbia federal court said the reasoning was “entirely irrational.”,,,,,
,,She thankfully has sufficient funds to support her as my father passed away 10 years ago. Now that I have finally started reviewing her portfolio overseen by this one broker I see he started buying very long term corporate bonds some not expiring for another 20 years from now in very large amounts (10000 shares to 20000 shares).,,,,,
,,“Today seemed like a microcosm of October—two way volatility sharp moves and acute turns which ultimately left both sides of the tape yearning for more by the close” said Frank Capelleri executive director of equity sales and trading at Instinet LLC.,,,,,
,,The big spending on a relatively new advertising medium fits with O’Rourke’s image. He has been described as a fresh face in politics and he has been known to live-stream his runs for hamburgers.,,,,,
,,If the financial institution making the distribution delays providing crucial information required to complete the rollover you may be eligible for a waiver (e.g. if you did not receive the appropriate forms in a timely manner). In addition a person can certify their eligibility for a waiver if the financial institution making the distribution does not disclose required information about completing the rollover process.,,,,,
Read: Millennials have more money than you think — so expect ESG funds in your 401(k),,,,,,,
,,Meanwhile the move by the Saudis to boost output would help ease a fourth-quarter supply shortage as U.S. sanctions against Iran come into force said analysts at Commerzbank.,,,,,
,,Another Wall Street analyst EvercoreISI’s Josh Schimmer has noted the “large unmet need for non-opioid options for pain in [osteoarthritis].” It’s possible that the right dose of the drug or the right monitoring could avoid the drug class’s safety problems he said.,,,,,
,,One taxpayer took a distribution to purchase her first home. However after the distribution had been taken she got a new job and decided to put the money back into an IRA within the 60-day period. The taxpayer filled out the application mailed it to the new company and proceeded to go on vacation for two weeks. Upon her return she realized the envelope had been returned due to an incorrect address. The taxpayer immediately contacted her adviser and sent the paperwork to the correct address. However the 60-day rollover period had already lapsed. In this case the IRS granted a rollover despite the fact that the 60-day limit had passed because by mailing the application she indicated her “intent” to preserve the distribution as part of her retirement savings.,,,,,
,"Japan’s Nikkei 225 index NIK -2.67%

     tumbled 2.7% and the Hong Kong’s Hang Seng Index HSI -3.08%

     dropped 3.1% in line with the retreat in China.",,,,,,
,,U.S. stocks bounced off intraday lows and major indexes trimmed early losses Tuesday but the S&P 500 still finished lower for a fifth session as a big drop in the Chinese market revived fresh questions about the global economy.,,,,,
"The stock market opened with a resounding thud on Tuesday morning as the Dow Jones Industrial Average DJIA -0.50%  at one point had shed more than 500 points. The S&P 500 index SPX -0.55%

     and the Nasdaq Composite COMP -0.42%

     endured even harder hits down more than 2% each.",,,,,,,
,Don’t miss: Cannabis is now legal in Canada but pot companies expect a rocky start.,,,,,,
So why did it come out on top, The high percentage of retirees who live there likely pushed Naples over the edge. Some 51% of the population is 65 or older the U.S. Census Bureau found. Florida is one of the five states with the highest median age population along with Maine New Hampshire Vermont and West Virginia.,,,,,,
“The divergence is telling” Parets explained in his blog post. “The last time we saw this was at the 2015 market top.”,,,,,,,
,• Marijuana beverages are the new thing but investors should only take sips,,,,,,
But “plain and simple -- Tesla is destroying the competition” it said. “It looks like it is the competition that is taking the Ambien” referring to Musk’s admission that he sometimes uses the sleeping pill.,,,,,,,
,,"I ran data going back to the 1890s. In 120 years the Dow Jones Industrial Average DJIA -0.50%

      declined in the six months after Halloween on 38 occasions. That’s nearly one year in three. And it declined by more than 5% on 23 occasions or roughly one time in five. But globally it has worked over time Zhang and Jacobsen’s data show.",,,,,
,,The personal-finance website SmartAsset recently analyzed the finances for citizens of 200 metro areas in the U.S. to find out how much income they’re earning passively through their investments. SmartAsset used Internal Revenue Service (IRS) data to rank those cities based on how much their citizens earn on four investment types: taxable interest dividends qualified dividends and capital gains.,,,,,
,,Trump’s executive order was meant to address concerns over H-1B visa abuse and keep a tight leash on government agency waivers on “Buy America” policies. Carreira is applying for a different type of visa the EB-1 visa her lawyers noted.,,,,,
,• Tilray is the poster boy of short-squeeze stock candidates — here’s how to find others,,,,,,
He pointed to several divergences that should make clear to investors just how precarious the market situation is at these current levels. The first one is what we’re seeing in this chart of the S&P vs. the rest of the world.,,,,,,,
,,Want news about Asia delivered to your inbox, Subscribe to MarketWatch's free Asia Daily newsletter. Sign up here.,,,,
